tweet_id,timestamp,source,text,rating_numerator,name,rating_denominator,Dog_breeds,breeds,month_years,years
700864154249383937,2016-02-20 02:06:50,Twitter for iPhone,"""Pupper is a present to world. Here is a bow for pupper."" 12/10 precious as hell https://t.co/ItSsE92gCW",12,a,10,pupper,pupper,2016-Feb,2016
699801817392291840,2016-02-17 03:45:29,Twitter for iPhone,This is Cooper. He began to tear up when his bone was taken from him. 11/10 stay strong pupper https://t.co/qI8yvqKG02,11,Cooper,10,pupper,pupper,2016-Feb,2016
696877980375769088,2016-02-09 02:07:12,Twitter for iPhone,This is Misty. She's in a predicament. Not sure what next move should be. 9/10 stay calm pupper I'm comin https://t.co/XhR7PAgcwF,9,Misty,10,pupper,pupper,2016-Feb,2016
696713835009417216,2016-02-08 15:14:57,Twitter for iPhone,This is Trevith. He's a Swiss Mountain Roadwoof. Breeze too powerful. 9/10 stay strong pupper https://t.co/6J8Ibwy1X6,9,Trevith,10,pupper,pupper,2016-Feb,2016
695095422348574720,2016-02-04 04:03:57,Twitter for iPhone,This is just a beautiful pupper good shit evolution. 12/10 https://t.co/2L8pI0Z2Ib,12,just,10,pupper,pupper,2016-Feb,2016
695074328191332352,2016-02-04 02:40:08,Twitter for iPhone,This is Lorenzo. He's educated af. Just graduated college. 11/10 poor pupper can't even comprehend his debt https://t.co/dH3GzcjCtQ,11,Lorenzo,10,pupper,pupper,2016-Feb,2016
694329668942569472,2016-02-02 01:21:07,Twitter for iPhone,Meet Grady. He's very hungry. Too bad no one can find his food bowl. 9/10 poor pupper https://t.co/oToIkYnEGn,9,Grady,10,pupper,pupper,2016-Feb,2016
693590843962331137,2016-01-31 00:25:18,Twitter for iPhone,Meet Phil. He's big af. Currently destroying this nice family home. Completely uncalled for. 3/10 not a good pupper https://t.co/fShNNhBWYx,3,Phil,10,pupper,pupper,2016-Jan,2016
693095443459342336,2016-01-29 15:36:45,Twitter for iPhone,This is Milo. He doesn't understand your fancy human gestures. Will lick instead. 10/10 can't faze this pupper https://t.co/OhodPIDOpW,10,Milo,10,pupper,pupper,2016-Jan,2016
692905862751522816,2016-01-29 03:03:25,Twitter for iPhone,This is Wally. He's being abducted by aliens. 10/10 poor pupper https://t.co/EiF659Bgjn,10,Wally,10,pupper,pupper,2016-Jan,2016
692417313023332352,2016-01-27 18:42:06,Twitter for iPhone,Meet Herschel. He's slightly bigger than ur average pupper. Looks lonely. Could probably ride 7/10 would totally pet https://t.co/VGaIMktX10,7,Herschel,10,pupper,pupper,2016-Jan,2016
689905486972461056,2016-01-20 20:21:00,Twitter for iPhone,"Say hello to Gizmo. He's quite the pupper. Confused by bed, but agile af. Can barely catch on camera. 11/10 so quick https://t.co/IE4ZblyZRY",11,Gizmo,10,pupper,pupper,2016-Jan,2016
689623661272240129,2016-01-20 01:41:08,Twitter for iPhone,This is Lucy. She's terrified of the stuffed billed dog. 10/10 stay strong pupper https://t.co/QnvSjjyh7n,10,Lucy,10,pupper,pupper,2016-Jan,2016
689143371370250240,2016-01-18 17:52:38,Twitter for iPhone,Meet Trip. He likes wearing costumes that aren't consistent with the season to screw with people 10/10 tricky pupper https://t.co/40w7TI5Axv,10,Trip,10,pupper,pupper,2016-Jan,2016
688894073864884227,2016-01-18 01:22:00,Twitter for iPhone,This is Hamrick. He's covered in corn flakes. Silly pupper. Looks congested. 7/10 considerably petable https://t.co/ROPZcAMQKI,7,Hamrick,10,pupper,pupper,2016-Jan,2016
688179443353796608,2016-01-16 02:02:19,Twitter for iPhone,This is Lizzie. She's about to fist bump the large ridable maned pupper. She's very excited. 10/10 for both dogs https://t.co/mFhvtX36om,10,Lizzie,10,pupper,pupper,2016-Jan,2016
687704180304273409,2016-01-14 18:33:48,Twitter for iPhone,Say hello to Blakely. He thinks that's a hat. Silly pupper. That's a nanner. 9/10 https://t.co/UwOV1jqKRt,9,Blakely,10,pupper,pupper,2016-Jan,2016
687476254459715584,2016-01-14 03:28:06,Twitter for iPhone,This is Curtis. He's a fluffball. 11/10 would snug this pupper https://t.co/1DzInODwrj,11,Curtis,10,pupper,pupper,2016-Jan,2016
686683045143953408,2016-01-11 22:56:10,Twitter for iPhone,This is Mona. She's a Yarborough Splishnsplash. Lost body during Nam. 11/10 revolutionary pupper https://t.co/pgD6h0yhgz,11,Mona,10,pupper,pupper,2016-Jan,2016
686618349602762752,2016-01-11 18:39:05,Twitter for iPhone,This is Olivia. She just saw an adult wearing crocs. 11/10 poor pupper. No one should witness such a thing https://t.co/yJVTi1DjJc,11,Olivia,10,pupper,pupper,2016-Jan,2016
686377065986265092,2016-01-11 02:40:19,Twitter for iPhone,Meet Birf. He thinks he's gone blind. 10/10 very frightened pupper https://t.co/oDkspjNWYX,10,Birf,10,pupper,pupper,2016-Jan,2016
685943807276412928,2016-01-09 21:58:42,Twitter for iPhone,This is the newly formed pupper a capella group. They're just starting out but I see tons of potential. 8/10 for all https://t.co/wbAcvFoNtn,8,the,10,pupper,pupper,2016-Jan,2016
685667379192414208,2016-01-09 03:40:16,Twitter for iPhone,This is Marty. He has no idea what happened here. Never seen this stuff in his life. 9/10 very suspicious pupper https://t.co/u427woxFpJ,9,Marty,10,pupper,pupper,2016-Jan,2016
685641971164143616,2016-01-09 01:59:19,Twitter for iPhone,This is Otis. He just passed a cop while going 61 in a 45. Very nervous pupper. 7/10 https://t.co/jJS8qQeuNO,7,Otis,10,pupper,pupper,2016-Jan,2016
685268753634967552,2016-01-08 01:16:17,Twitter for iPhone,This is Hubertson. He's a Carmel Haberdashery. Enjoys long summer days on his boat. Very peaceful pupper. 10/10 https://t.co/vzCl35fKlZ,10,Hubertson,10,pupper,pupper,2016-Jan,2016
685169283572338688,2016-01-07 18:41:01,Twitter for iPhone,Meet Gerbald. He just found out he's adopted. Poor pupper. Snazzy tongue tho. 11/10 would hold close in time of need https://t.co/UfGkB9Wrud,11,Gerbald,10,pupper,pupper,2016-Jan,2016
684147889187209216,2016-01-04 23:02:22,Vine - Make a Scene,This is Sweets the English Bulldog. Waves back to other bikers. 12/10 just a fantastic friendly pupper https://t.co/WYiFzuX7D4,12,Sweets,10,pupper,pupper,2016-Jan,2016
683481228088049664,2016-01-03 02:53:17,Twitter for iPhone,Meet Banjo. He's a Peppercorn Shoop Da Whoop. Nails look lethal. Skeptical of luminescent orb 11/10 stay woke pupper https://t.co/H7NZFumpKq,11,Banjo,10,pupper,pupper,2016-Jan,2016
683142553609318400,2016-01-02 04:27:31,Twitter for iPhone,Meet Brandy. She's a member of the Bloods. Menacing criminal pupper. Soft spot for flowers tho. 9/10 pet w caution https://t.co/hhIA3coiAJ,9,Brandy,10,pupper,pupper,2016-Jan,2016
683111407806746624,2016-01-02 02:23:45,Twitter for iPhone,This is Larry. He thought the New Year's parties were tonight. 10/10 poor pupper. Maybe next year https://t.co/h3X0jK8MVM,10,Larry,10,pupper,pupper,2016-Jan,2016
682406705142087680,2015-12-31 03:43:31,Twitter for iPhone,This is Patrick. He's a bigass pupper. 7/10 https://t.co/J9DXBFoAQe,7,Patrick,10,pupper,pupper,2015-Dec,2015
681891461017812993,2015-12-29 17:36:07,Twitter for iPhone,Say hello to Charlie. He's scholarly af. Quite intimidating with all his pupper knowledge 10/10 even built that fire https://t.co/9KThv6z8u5,10,Charlie,10,pupper,pupper,2015-Dec,2015
681694085539872773,2015-12-29 04:31:49,Twitter for iPhone,This is Bo. He's a Benedoop Cumbersnatch. Seems frustrated with own feet. Portable as hell. 11/10 very solid pupper https://t.co/TONMhRoQh7,11,Bo,10,pupper,pupper,2015-Dec,2015
681654059175129088,2015-12-29 01:52:46,Twitter for iPhone,This is Toffee. He's a happy pupper. Appears dangerously fluffy. Extraordinarily spherical. 12/10 would pet firmly https://t.co/oEXEKt3MHu,12,Toffee,10,pupper,pupper,2015-Dec,2015
680836378243002368,2015-12-26 19:43:36,Twitter for iPhone,This is Ellie. She's secretly ferocious. 12/10 very deadly pupper https://t.co/BF4BW8LUgb,12,Ellie,10,pupper,pupper,2015-Dec,2015
680473011644985345,2015-12-25 19:39:43,Twitter for iPhone,"This is Hector. He thinks he's a hammer. Silly Hector. You're a pupper, not a hammer. 10/10 https://t.co/OdUFuZIXiI",10,Hector,10,pupper,pupper,2015-Dec,2015
680145970311643136,2015-12-24 22:00:10,Twitter for iPhone,Say hello to Kawhi. He was doing fine until his hat fell off. He got it back though. 10/10 deep breaths pupper https://t.co/N5pM6WBx7e,10,Kawhi,10,pupper,pupper,2015-Dec,2015
679777920601223168,2015-12-23 21:37:40,Twitter for iPhone,This is Rinna. She's melting. 10/10 get inside pupper https://t.co/PA0czwucsb,10,Rinna,10,pupper,pupper,2015-Dec,2015
679503373272485890,2015-12-23 03:26:43,Twitter for iPhone,This is Dwight. He's a pointy pupper. Very docile. Attracts marshmallows. Hurts to pet but definitely worth it 8/10 https://t.co/jjW7zTxY9Z,8,Dwight,10,pupper,pupper,2015-Dec,2015
678389028614488064,2015-12-20 01:38:42,Twitter for iPhone,"This is Bella. She just learned that her final grade in chem was a 92.49 
poor pupper 11/10 https://t.co/auOoKuoveM",11,Bella,10,pupper,pupper,2015-Dec,2015
677269281705472000,2015-12-16 23:29:14,Twitter for iPhone,This is the happiest pupper I've ever seen. 10/10 would trade lives with https://t.co/ep8ATEJwRb,10,the,10,pupper,pupper,2015-Dec,2015
676603393314578432,2015-12-15 03:23:14,Twitter for iPhone,This is Godzilla pupper. He had a ruff childhood &amp; now deflects that pain outward by terrorizing cities. Tragic 9/10 https://t.co/g1tLGkyaxr,9,Godzilla,10,pupper,pupper,2015-Dec,2015
675845657354215424,2015-12-13 01:12:15,Twitter for iPhone,"This is Pepper. She's not fully comfortable riding her imaginary bike yet. 10/10 don't worry pupper, it gets easier https://t.co/40dj4eTsXG",10,Pepper,10,pupper,pupper,2015-Dec,2015
675113801096802304,2015-12-11 00:44:07,Twitter for iPhone,Meet Zuzu. He just graduated college. Astute pupper. Needs 2 leashes to contain him. Wasn't ready for the pic. 10/10 https://t.co/2H5SKmk0k7,10,Zuzu,10,pupper,pupper,2015-Dec,2015
675006312288268288,2015-12-10 17:37:00,Twitter for iPhone,Say hello to Mollie. This pic was taken after she bet all her toys on Ronda Rousey. 10/10 hang in there pupper https://t.co/QMmAqA9VqO,10,Mollie,10,pupper,pupper,2015-Dec,2015
674774481756377088,2015-12-10 02:15:47,Twitter for iPhone,This is Superpup. His head isn't proportional to his body. Has yet to serve any justice. 11/10 maybe one day pupper https://t.co/gxIFgg8ktm,11,Superpup,10,pupper,pupper,2015-Dec,2015
674737130913071104,2015-12-09 23:47:22,Twitter for iPhone,Meet Rufio. He is unaware of the pink legless pupper wrapped around him. Might want to get that checked 10/10 &amp; 4/10 https://t.co/KNfLnYPmYh,10,Rufio,10,pupper,pupper,2015-Dec,2015
674318007229923329,2015-12-08 20:01:55,Twitter for iPhone,This is Lennon. He's in quite the predicament. 8/10 hang in there pupper https://t.co/7mf8XXPAZv,8,Lennon,10,pupper,pupper,2015-Dec,2015
674262580978937856,2015-12-08 16:21:41,Twitter for iPhone,This is Gus. He's super stoked about being an elephant. Couldn't be happier. 9/10 for elephant pupper https://t.co/gJS1qU0jP7,9,Gus,10,pupper,pupper,2015-Dec,2015
674038233588723717,2015-12-08 01:30:12,Twitter for iPhone,This is Kaiya. She's an aspiring shoe model. 12/10 follow your dreams pupper https://t.co/nX8FiGRHvk,12,Kaiya,10,pupper,pupper,2015-Dec,2015
673956914389192708,2015-12-07 20:07:04,Twitter for iPhone,This is one esteemed pupper. Just graduated college. 10/10 what a champ https://t.co/nyReCVRiyd,10,one,10,pupper,pupper,2015-Dec,2015
673919437611909120,2015-12-07 17:38:09,Twitter for iPhone,This is Obie. He is on guard watching for evildoers from the comfort of his pumpkin. Very brave pupper. 11/10 https://t.co/cdwPTsGEAb,11,Obie,10,pupper,pupper,2015-Dec,2015
673707060090052608,2015-12-07 03:34:14,Twitter for iPhone,This is Raymond. He's absolutely terrified of floating tennis ball. 10/10 it'll be ok pupper https://t.co/QyH1CaY3SM,10,Raymond,10,pupper,pupper,2015-Dec,2015
673697980713705472,2015-12-07 02:58:09,Twitter for iPhone,This is Pickles. She's a tiny pointy pupper. Average walker. Very skeptical of wet leaf. 8/10 https://t.co/lepRCaGcgw,8,Pickles,10,pupper,pupper,2015-Dec,2015
673656262056419329,2015-12-07 00:12:23,Twitter for iPhone,This is Albert AKA King Banana Peel. He's a kind ruler of the kitchen. Very jubilant pupper. 10/10 overall great dog https://t.co/PN8hxgZ9We,10,Albert,10,pupper,pupper,2015-Dec,2015
673612854080196609,2015-12-06 21:19:54,Twitter for iPhone,This is Jeffri. He's a speckled ice pupper. Very lazy. Enjoys the occasional swim. Rather majestic really. 7/10 https://t.co/0iyItbtkr8,7,Jeffri,10,pupper,pupper,2015-Dec,2015
673342308415348736,2015-12-06 03:24:51,Twitter for iPhone,This is Django. He's a skilled assassin pupper. 10/10 https://t.co/w0YTuiRd1a,10,Django,10,pupper,pupper,2015-Dec,2015
673295268553605120,2015-12-06 00:17:55,Twitter for iPhone,Meet Eve. She's a raging alcoholic 8/10 (would b 11/10 but pupper alcoholism is a tragic issue that I can't condone) https://t.co/U36HYQIijg,8,Eve,10,pupper,pupper,2015-Dec,2015
673148804208660480,2015-12-05 14:35:56,Twitter for iPhone,This is Fletcher. He's had a ruff night. No more Fireball for Fletcher. 8/10 it'll be over soon pupper https://t.co/tA4WpkI2cw,8,Fletcher,10,pupper,pupper,2015-Dec,2015
672988786805112832,2015-12-05 04:00:04,Twitter for iPhone,This is Schnozz. He's had a blurred tail since birth. Hasn't let that stop him. 10/10 inspirational pupper https://t.co/a3zYMcvbXG,10,Schnozz,10,pupper,pupper,2015-Dec,2015
672975131468300288,2015-12-05 03:05:49,Twitter for iPhone,This is Chuckles. He is one skeptical pupper. 10/10 stay woke Chuckles https://t.co/ZlcF0TIRW1,10,Chuckles,10,pupper,pupper,2015-Dec,2015
672970152493887488,2015-12-05 02:46:02,Twitter for iPhone,This is Chet. He's having a hard time. Really struggling. 7/10 hang in there pupper https://t.co/eb4ta0xtnd,7,Chet,10,pupper,pupper,2015-Dec,2015
672898206762672129,2015-12-04 22:00:08,Twitter for iPhone,This is Cheryl AKA Queen Pupper of the Skies. Experienced fighter pilot. Much skill. True hero. 11/10 https://t.co/i4XJEWwdsp,11,Cheryl,10,pupper,pupper,2015-Dec,2015
672614745925664768,2015-12-04 03:13:46,Twitter for iPhone,This is Norman. Doesn't bark much. Very docile pup. Up to date on current events. Overall nifty pupper. 6/10 https://t.co/ntxsR98f3U,6,Norman,10,pupper,pupper,2015-Dec,2015
672594978741354496,2015-12-04 01:55:13,Twitter for iPhone,Meet Scott. Just trying to catch his train to work. Doesn't need everybody staring. 9/10 ignore the haters pupper https://t.co/jyXbZ35MYz,9,Scott,10,pupper,pupper,2015-Dec,2015
672481316919734272,2015-12-03 18:23:34,Twitter for iPhone,Say hello to Jazz. She should be on the cover of Vogue. 12/10 gorgeous pupper https://t.co/mVCMemhXAP,12,Jazz,10,pupper,pupper,2015-Dec,2015
672254177670729728,2015-12-03 03:21:00,Twitter for iPhone,This is Rolf. He's having the time of his life. 11/10 good pupper https://t.co/OO6MqEbqG3,11,Rolf,10,pupper,pupper,2015-Dec,2015
672205392827572224,2015-12-03 00:07:09,Twitter for iPhone,This is Opal. He's a Royal John Coctostan. Ready for transport. Basically indestructible. 9/10 good pupper https://t.co/yRBQF9OS7D,9,Opal,10,pupper,pupper,2015-Dec,2015
672160042234327040,2015-12-02 21:06:56,Twitter for iPhone,This is Bubba. He's a Titted Peebles Aorta. Evolutionary masterpiece. Comfortable with his body. 8/10 great pupper https://t.co/aNkkl5nH3W,8,Bubba,10,pupper,pupper,2015-Dec,2015
889531135344209921,2017-07-24 17:02:04,Twitter for iPhone,This is Stuart. He's sporting his favorite fanny pack. Secretly filled with bones only. 13/10 puppared puppo #BarkWeek https://t.co/y70o6h3isq,13,Stuart,10,puppo,puppo,2017-Jul,2017
878776093423087618,2017-06-25 00:45:22,Twitter for iPhone,This is Snoopy. He's a proud #PrideMonthPuppo. Impeccable handwriting for not having thumbs. 13/10 would love back #PrideMonth https://t.co/lNZwgNO4gS,13,Snoopy,10,puppo,puppo,2017-Jun,2017
874012996292530176,2017-06-11 21:18:31,Twitter for iPhone,"This is Sebastian. He can't see all the colors of the rainbow, but he can see that this flag makes his human happy. 13/10 #PrideMonth puppo https://t.co/XBE0evJZ6V",13,Sebastian,10,puppo,puppo,2017-Jun,2017
867421006826221569,2017-05-24 16:44:18,Twitter for iPhone,This is Shikha. She just watched you drop a skittle on the ground and still eat it. Could not be less impressed. 12/10 superior puppo https://t.co/XZlZKd73go,12,Shikha,10,puppo,puppo,2017-May,2017
825026590719483904,2017-01-27 17:04:02,Twitter for iPhone,"Say hello to Pablo. He's one gorgeous puppo. A true 12/10. Click the link to see why Pablo requests your assistance

https://t.co/koHvVQp9bL https://t.co/IhW0JKf7kc",12,Pablo,10,puppo,puppo,2017-Jan,2017
819952236453363712,2017-01-13 17:00:21,Twitter for iPhone,"This is Oliver. He has dreams of being a service puppo so he can help his owner. 13/10 selfless af

make it happen:
https://t.co/f5WMsx0a9K https://t.co/6lJz0DKZIb",13,Oliver,10,puppo,puppo,2017-Jan,2017
803773340896923648,2016-11-30 01:31:12,Twitter for iPhone,This is Diogi. He fell in the pool as soon as he was brought home. Clumsy puppo. 12/10 would pet until dry https://t.co/ZxeRjMKaWt,12,Diogi,10,puppo,puppo,2016-Nov,2016
802239329049477120,2016-11-25 19:55:35,Twitter for iPhone,This is Loki. He'll do your taxes for you. Can also make room in your budget for all the things you bought today. 12/10 what a puppo https://t.co/5oWrHCWg87,12,Loki,10,puppo,puppo,2016-Nov,2016
793195938047070209,2016-10-31 21:00:23,Twitter for iPhone,Say hello to Lily. She's pupset that her costume doesn't fit as well as last year. 12/10 poor puppo https://t.co/YSi6K1firY,12,Lily,10,puppo,puppo,2016-Oct,2016
790946055508652032,2016-10-25 16:00:09,Twitter for iPhone,This is Betty. She's assisting with the dishes. Such a good puppo. 12/10 h*ckin helpful af https://t.co/dgvTPZ9tgI,12,Betty,10,puppo,puppo,2016-Oct,2016
787717603741622272,2016-10-16 18:11:26,Twitter for iPhone,This is Tonks. She is a service puppo. Can hear a caterpillar hiccup from 7 miles away. 13/10 would follow anywhere https://t.co/i622ZbWkUp,13,Tonks,10,puppo,puppo,2016-Oct,2016
784183165795655680,2016-10-07 00:06:50,Vine - Make a Scene,This is Reginald. He's one magical puppo. Aerodynamic af. 12/10 would catch https://t.co/t0cEeRbcXJ,12,Reginald,10,puppo,puppo,2016-Oct,2016
751132876104687617,2016-07-07 19:16:47,Twitter for iPhone,This is Cooper. He's just so damn happy. 10/10 what's your secret puppo? https://t.co/yToDwVXEpA,10,Cooper,10,puppo,puppo,2016-Jul,2016
744995568523612160,2016-06-20 20:49:19,Twitter for iPhone,This is Abby. She got her face stuck in a glass. Churlish af. 9/10 rookie move puppo https://t.co/2FPb45NXrK,9,Abby,10,puppo,puppo,2016-Jun,2016
743253157753532416,2016-06-16 01:25:36,Twitter for iPhone,"This is Kilo. He cannot reach the snackum. Nifty tongue, but not nifty enough. 10/10 maybe one day puppo https://t.co/gSmp31Zrsx",10,Kilo,10,puppo,puppo,2016-Jun,2016
738537504001953792,2016-06-03 01:07:16,Twitter for iPhone,This is Bayley. She fell asleep trying to escape her evil fence enclosure. 11/10 night night puppo https://t.co/AxSiqAKEKu,11,Bayley,10,puppo,puppo,2016-Jun,2016
