tweet_id,timestamp,source,text,rating_numerator,name,rating_denominator,Dog_breeds,breeds,month_years,years
890240255349198849,2017-07-26 15:59:51,Twitter for iPhone,This is Cassie. She is a college pup. Studying international doggo communication and stick theory. 14/10 so elegant much sophisticate https://t.co/t1bfwz5S2A,14,Cassie,10,doggo,doggo,2017-Jul,2017
884162670584377345,2017-07-09 21:29:42,Twitter for iPhone,Meet Yogi. He doesn't have any important dog meetings today he just enjoys looking his best at all times. 12/10 for dangerously dapper doggo https://t.co/YSI00BzTBZ,12,Yogi,10,doggo,doggo,2017-Jul,2017
871515927908634625,2017-06-04 23:56:03,Twitter for iPhone,This is Napolean. He's a Raggedy East Nicaraguan Zoom Zoom. Runs on one leg. Built for deception. No eyes. Good with kids. 12/10 great doggo https://t.co/PR7B7w1rUw,12,Napolean,10,doggo,doggo,2017-Jun,2017
869596645499047938,2017-05-30 16:49:31,Twitter for iPhone,This is Scout. He just graduated. Officially a doggo now. Have fun with taxes and losing sight of your ambitions. 12/10 would throw cap for https://t.co/DsA2hwXAJo,12,Scout,10,doggo,doggo,2017-May,2017
846514051647705089,2017-03-28 00:07:32,Twitter for iPhone,This is Barney. He's an elder doggo. Hitches a ride when he gets tired. Waves goodbye before he leaves. 13/10 please come back soon https://t.co/cFAasDXauK,13,Barney,10,doggo,doggo,2017-Mar,2017
845397057150107648,2017-03-24 22:08:59,Twitter for iPhone,"Say hello to Mimosa. She's an emotional support doggo who helps her owner with PTSD. 13/10, but she needs your help

https://t.co/L6mLzrd7Mx https://t.co/jMutBFdw5o",13,Mimosa,10,doggo,doggo,2017-Mar,2017
836753516572119041,2017-03-01 01:42:39,Twitter for iPhone,This is Meera. She just heard about taxes and how much a doghouse in a nice area costs. Not pupared to be a  doggo anymore. 12/10 https://t.co/GZmNEdyoJY,12,Meera,10,doggo,doggo,2017-Mar,2017
832998151111966721,2017-02-18 17:00:10,Twitter for iPhone,"This is Rhino. He arrived at a shelter with an elaborate doggo manual for his new family, written by someone who will always love him. 13/10 https://t.co/QX1h0oqMz0",13,Rhino,10,doggo,doggo,2017-Feb,2017
832273440279240704,2017-02-16 17:00:25,Twitter for iPhone,Say hello to Smiley. He's a blind therapy doggo having a h*ckin blast high steppin around in the snow. 14/10 would follow anywhere https://t.co/SHAb1wHjMz,14,Smiley,10,doggo,doggo,2017-Feb,2017
832032802820481025,2017-02-16 01:04:13,Twitter for iPhone,"This is Miguel. He was the only remaining doggo at the adoption center after the weekend. Let's change that. 12/10

https://t.co/P0bO8mCQwN https://t.co/SU4K34NT4M",12,Miguel,10,doggo,doggo,2017-Feb,2017
831939777352105988,2017-02-15 18:54:34,Twitter for iPhone,This is Emanuel. He's a h*ckin rare doggo. Dwells in a semi-urban environment. Round features make him extra collectible. 12/10 would so pet https://t.co/k9bzgyVdUT,12,Emanuel,10,doggo,doggo,2017-Feb,2017
831322785565769729,2017-02-14 02:02:51,Twitter for iPhone,This is Pete. He has no eyes. Needs a guide doggo. Also appears to be considerably fluffy af. 12/10 would hug softly https://t.co/Xc0gyovCtK,12,Pete,10,doggo,doggo,2017-Feb,2017
829374341691346946,2017-02-08 17:00:26,Twitter for iPhone,This is Astrid. She's a guide doggo in training. 13/10 would follow anywhere https://t.co/xo7FZFIAao,13,Astrid,10,doggo,doggo,2017-Feb,2017
828381636999917570,2017-02-05 23:15:47,Twitter for iPhone,Meet Doobert. He's a deaf doggo. Didn't stop him on the field tho. Absolute legend today. 14/10 would pat head approvingly https://t.co/iCk7zstRA9,14,Doobert,10,doggo,doggo,2017-Feb,2017
826958653328592898,2017-02-02 01:01:21,Twitter for iPhone,This is Loki. He smiles like Elvis. Ain't nothin but a hound doggo. 12/10 https://t.co/QV5nx6otZR,12,Loki,10,doggo,doggo,2017-Feb,2017
826848821049180160,2017-02-01 17:44:55,Twitter for iPhone,This is Cupid. He was found in the trash. Now he's well on his way to prosthetic front legs and a long happy doggo life. 13/10 heroic af https://t.co/WS0Gha8vRh,13,Cupid,10,doggo,doggo,2017-Feb,2017
826476773533745153,2017-01-31 17:06:32,Twitter for iPhone,This is Pilot. He has mastered the synchronized head tilt and sneaky tongue slip. Usually not unlocked until later doggo days. 12/10 https://t.co/YIV8sw8xkh,12,Pilot,10,doggo,doggo,2017-Jan,2017
821765923262631936,2017-01-18 17:07:18,Twitter for iPhone,This is Duchess. She uses dark doggo forces to levitate her toys. 13/10 magical af https://t.co/maDNMETA52,13,Duchess,10,doggo,doggo,2017-Jan,2017
821407182352777218,2017-01-17 17:21:47,Twitter for iPhone,This is Sundance. He's a doggo drummer. Even sings a bit on the side. 14/10 entertained af (vid by @sweetsundance) https://t.co/Xn5AQtiqzG,14,Sundance,10,doggo,doggo,2017-Jan,2017
819006400881917954,2017-01-11 02:21:57,Twitter for iPhone,This is Sunny. She was also a very good First Doggo. 14/10 would also be an absolute honor to pet https://t.co/YOC1fHFCSb,14,Sunny,10,doggo,doggo,2017-Jan,2017
819004803107983360,2017-01-11 02:15:36,Twitter for iPhone,This is Bo. He was a very good First Doggo. 14/10 would be an absolute honor to pet https://t.co/AdPKrI8BZ1,14,Bo,10,doggo,doggo,2017-Jan,2017
817777686764523521,2017-01-07 16:59:28,Twitter for iPhone,"This is Dido. She's playing the lead role in ""Pupper Stops to Catch Snow Before Resuming Shadow Box with Dried Apple."" 13/10 (IG: didodoggo) https://t.co/m7isZrOBX7",13,Dido,10,doggo,doggo,2017-Jan,2017
813910438903693312,2016-12-28 00:52:25,Twitter for iPhone,This is Chubbs. He dug a hole and now he's stuck in it. Dang h*ckin doggo. 11/10 would assist https://t.co/z1VRj1cYZf,11,Chubbs,10,doggo,doggo,2016-Dec,2016
813096984823349248,2016-12-25 19:00:02,Twitter for iPhone,This is Rocky. He got triple-doggo-dared. Stuck af. 11/10 someone help him https://t.co/soNL00XWVu,11,Rocky,10,doggo,doggo,2016-Dec,2016
801115127852503040,2016-11-22 17:28:25,Twitter for iPhone,This is Bones. He's being haunted by another doggo of roughly the same size. 12/10 deep breaths pupper everything's fine https://t.co/55Dqe0SJNj,12,Bones,10,doggo,doggo,2016-Nov,2016
799757965289017345,2016-11-18 23:35:32,Twitter for iPhone,This is Sobe. She's a h*ckin happy doggo. Only one leg tho. Must have good balance. 13/10 would smile back https://t.co/OiH8PaOxB1,13,Sobe,10,doggo,doggo,2016-Nov,2016
786363235746385920,2016-10-13 00:29:39,Twitter for iPhone,This is Rizzo. He has many talents. A true renaissance doggo. 13/10 entertaining af https://t.co/TVXpEJB7Wn,13,Rizzo,10,doggo,doggo,2016-Oct,2016
785639753186217984,2016-10-11 00:34:48,Twitter for iPhone,This is Pinot. He's a sophisticated doggo. You can tell by the hat. Also pointier than your average pupper. Still 10/10 would pet cautiously https://t.co/f2wmLZTPHd,10,Pinot,10,doggo,doggo,2016-Oct,2016
782747134529531904,2016-10-03 01:00:34,Twitter for iPhone,This is Deacon. He's the happiest almost dry doggo I've ever seen. 11/10 would smile back https://t.co/C6fUMnHt1H,11,Deacon,10,doggo,doggo,2016-Oct,2016
782305867769217024,2016-10-01 19:47:08,Twitter for iPhone,This is Sampson. He just graduated. Ready to be a doggo now. Time for the real world. 12/10 have fun with taxes https://t.co/pgVKxRw0s1,12,Sampson,10,doggo,doggo,2016-Oct,2016
781655249211752448,2016-09-30 00:41:48,Vine - Make a Scene,This is Combo. The daily struggles of being a doggo have finally caught up with him. 11/10 https://t.co/LOKrNo0OM7,11,Combo,10,doggo,doggo,2016-Sep,2016
775733305207554048,2016-09-13 16:30:07,Twitter for iPhone,This is Anakin. He strives to reach his full doggo potential. Born with blurry tail tho. 11/10 would still pet well https://t.co/9CcBSxCXXG,11,Anakin,10,doggo,doggo,2016-Sep,2016
775364825476165632,2016-09-12 16:05:54,Twitter for iPhone,This is Finley. He's an independent doggo still adjusting to life on his own. 11/10 https://t.co/7FNcBaKbci,11,Finley,10,doggo,doggo,2016-Sep,2016
768193404517830656,2016-08-23 21:09:14,Twitter for iPhone,Meet Gerald. He's a fairly exotic doggo. Floofy af. Inadequate knees tho. Self conscious about large forehead. 8/10 https://t.co/WmczvjCWJq,8,Gerald,10,doggo,doggo,2016-Aug,2016
760893934457552897,2016-08-03 17:43:45,Twitter for iPhone,This is Wishes. He has the day off. Daily struggles of being a doggo have finally caught up with him. 11/10 https://t.co/H9YgrUkYwa,11,Wishes,10,doggo,doggo,2016-Aug,2016
759793422261743616,2016-07-31 16:50:42,Twitter for iPhone,"Meet Maggie &amp; Lila. Maggie is the doggo, Lila is the pupper. They are sisters. Both 12/10 would pet at the same time https://t.co/MYwR4DQKll",12,Maggie,10,doggo,doggo,2016-Jul,2016
755206590534418437,2016-07-19 01:04:16,Twitter for iPhone,This is one of the most inspirational stories I've ever come across. I have no words. 14/10 for both doggo and owner https://t.co/I5ld3eKD5k,14,one,10,doggo,doggo,2016-Jul,2016
750011400160841729,2016-07-04 17:00:26,TweetDeck,Meet Piper. She's an airport doggo. Please return your tray table to its full pupright and locked position. 11/10 https://t.co/D17IAcetmM,11,Piper,10,doggo,doggo,2016-Jul,2016
749075273010798592,2016-07-02 03:00:36,Vine - Make a Scene,This is Boomer. He's self-baptizing. Other doggo not ready to renounce sins. 11/10 spiritually awakened af https://t.co/cRTJiQQk9o,11,Boomer,10,doggo,doggo,2016-Jul,2016
748932637671223296,2016-07-01 17:33:49,Twitter for iPhone,Say hello to Divine Doggo. Must be magical af. 13/10 would be an honor to pet https://t.co/BbcABzohKb,13,Divine,10,doggo,doggo,2016-Jul,2016
748692773788876800,2016-07-01 01:40:41,Twitter for iPhone,That is Quizno. This is his beach. He does not tolerate human shenanigans on his beach. 10/10 reclaim ur land doggo https://t.co/vdr7DaRSa7,10,his,10,doggo,doggo,2016-Jul,2016
745433870967832576,2016-06-22 01:50:58,Twitter for iPhone,This is Lenox. She's in a wheelbarrow. Silly doggo. You don't belong there. 10/10 would push around https://t.co/oYbVR4nBsR,10,Lenox,10,doggo,doggo,2016-Jun,2016
741067306818797568,2016-06-10 00:39:48,Twitter for iPhone,This is just downright precious af. 12/10 for both pupper and doggo https://t.co/o5J479bZUC,12,just,10,doggo,doggo,2016-Jun,2016
735256018284875776,2016-05-24 23:47:49,Twitter for iPhone,This is Kellogg. He accidentally opened the front facing camera. 8/10 get it together doggo https://t.co/MRYv7nDPyS,8,Kellogg,10,doggo,doggo,2016-May,2016
732375214819057664,2016-05-17 01:00:32,Twitter for iPhone,This is Kyle (pronounced 'Mitch'). He strives to be the best doggo he can be. 11/10 would pat on head approvingly https://t.co/aA2GiTGvlE,11,Kyle,10,doggo,doggo,2016-May,2016
883360690899218434,2017-07-07 16:22:55,Twitter for iPhone,Meet Grizzwald. He may be the floofiest floofer I ever did see. Lost eyes saving a schoolbus from a volcano erpuption. 13/10 heroic as h*ck https://t.co/rf661IFEYP,13,Grizzwald,10,floofer,floofer,2017-Jul,2017
800388270626521089,2016-11-20 17:20:08,Twitter for iPhone,This is Doc. He takes time out of every day to worship our plant overlords. 12/10 quite the floofer https://t.co/azMneS6Ly5,12,Doc,10,floofer,floofer,2016-Nov,2016
749317047558017024,2016-07-02 19:01:20,Twitter for iPhone,This is Blu. He's a wild bush Floofer. I wish anything made me as happy as bushes make Blu. 12/10 would frolic with https://t.co/HHUAnBb6QB,12,Blu,10,floofer,floofer,2016-Jul,2016
733822306246479872,2016-05-21 00:50:46,Twitter for iPhone,This is Moose. He's a Polynesian Floofer. Dapper af. 10/10 would pet diligently https://t.co/mVfqRdppTL,10,Moose,10,floofer,floofer,2016-May,2016
685307451701334016,2016-01-08 03:50:03,Twitter for iPhone,Say hello to Petrick. He's an Altostratus Floofer. Just had a run in with a trash bag. Groovy checkered floor. 11/10 https://t.co/rwW7z1JAOF,11,Petrick,10,floofer,floofer,2016-Jan,2016
886366144734445568,2017-07-15 23:25:31,Twitter for iPhone,This is Roscoe. Another pupper fallen victim to spontaneous tongue ejections. Get the BlepiPen immediate. 12/10 deep breaths Roscoe https://t.co/RGE08MIJox,12,Roscoe,10,pupper,pupper,2017-Jul,2017
882762694511734784,2017-07-06 00:46:41,Twitter for iPhone,This is Gus. He's quite the cheeky pupper. Already perfected the disinterested wink. 12/10 would let steal my girl https://t.co/D43I96SlVu,12,Gus,10,pupper,pupper,2017-Jul,2017
881536004380872706,2017-07-02 15:32:16,Twitter for iPhone,"Here is a pupper approaching maximum borkdrive. Zooming at never before seen speeds. 14/10 paw-inspiring af 
(IG: puffie_the_chow) https://t.co/ghXBIIeQZF",14,a,10,pupper,pupper,2017-Jul,2017
876838120628539392,2017-06-19 16:24:33,Twitter for iPhone,This is Ginger. She's having a ruff Monday. Too many pupper things going on. H*ckin exhausting. 12/10 would snug passionately https://t.co/j211oCDRs6,12,Ginger,10,pupper,pupper,2017-Jun,2017
874296783580663808,2017-06-12 16:06:11,Twitter for iPhone,This is Jed. He may be the fanciest pupper in the game right now. Knows it too. 13/10 would sign modeling contract https://t.co/0YplNnSMEm,13,Jed,10,pupper,pupper,2017-Jun,2017
873213775632977920,2017-06-09 16:22:42,Twitter for iPhone,"This is Sierra. She's one precious pupper. Absolute 12/10. Been in and out of ICU her whole life. Help Sierra below

https://t.co/Xp01EU3qyD https://t.co/V5lkvrGLdQ",12,Sierra,10,pupper,pupper,2017-Jun,2017
871762521631449091,2017-06-05 16:15:56,Twitter for iPhone,This is Rover. As part of pupper protocol he had to at least attempt to eat the plant. Confirmed not tasty. Needs peanut butter. 12/10 https://t.co/AiVljI6QCg,12,Rover,10,pupper,pupper,2017-Jun,2017
866450705531457537,2017-05-22 00:28:40,Twitter for iPhone,"This is Jamesy. He gives a kiss to every other pupper he sees on his walk. 13/10 such passion, much tender https://t.co/wk7TfysWHr",13,Jamesy,10,pupper,pupper,2017-May,2017
850019790995546112,2017-04-06 16:18:05,Twitter for iPhone,Say hello to Boomer. He's a sandy pupper. Having a h*ckin blast. 12/10 would pet passionately https://t.co/ecb3LvExde,12,Boomer,10,pupper,pupper,2017-Apr,2017
845306882940190720,2017-03-24 16:10:40,Twitter for iPhone,This is Pickles. She's a silly pupper. Thinks she's a dish. 12/10 would dry https://t.co/7mPCF4ZwEk,12,Pickles,10,pupper,pupper,2017-Mar,2017
837110210464448512,2017-03-02 01:20:01,Twitter for iPhone,This is Clark. He passed pupper training today. Round of appaws for Clark. 13/10 https://t.co/7pUjwe8X6B,13,Clark,10,pupper,pupper,2017-Mar,2017
836380477523124226,2017-02-28 01:00:19,Twitter for iPhone,"This is Ava. She just blasted off. Streamline af. Aerodynamic as h*ck. One small step for pupper, one giant leap for pupkind. 12/10 https://t.co/W4KffrdX3Q",12,Ava,10,pupper,pupper,2017-Feb,2017
833124694597443584,2017-02-19 01:23:00,Twitter for iPhone,This is Gidget. She's a spy pupper. Stealthy as h*ck. Must've slipped pup and got caught. 12/10 would forgive then pet https://t.co/zD97KYFaFa,12,Gidget,10,pupper,pupper,2017-Feb,2017
827933404142436356,2017-02-04 17:34:40,Twitter for iPhone,This is Kona. Yesterday she stopped by the department to see what it takes to be a police pupper. 12/10 vest was only a smidge too big https://t.co/j8D3PQJvpJ,12,Kona,10,pupper,pupper,2017-Feb,2017
822462944365645825,2017-01-20 15:17:01,Twitter for iPhone,"This is Gabe. He was the unequivocal embodiment of a dream meme, but also one h*ck of a pupper. You will be missed by so many. 14/10 RIP https://t.co/M3hZGadUuO",14,Gabe,10,pupper,pupper,2017-Jan,2017
814986499976527872,2016-12-31 00:08:17,Twitter for iPhone,This is Cooper. Someone attacked him with a sharpie. Poor pupper. 11/10 nifty tongue slip tho https://t.co/01vpuRDXQ8,11,Cooper,10,pupper,pupper,2016-Dec,2016
811386762094317568,2016-12-21 01:44:13,Twitter for iPhone,This is Craig. That's actually a normal sized fence he's stuck on. H*ckin massive pupper. 11/10 someone help him https://t.co/aAUXzoxaBy,11,Craig,10,pupper,pupper,2016-Dec,2016
807621403335917568,2016-12-10 16:22:02,Twitter for iPhone,This is Ollie Vue. He was a 3 legged pupper on a mission to overcome everything. This is very hard to write. 14/10 we will miss you Ollie https://t.co/qTRY2qX9y4,14,Ollie,10,pupper,pupper,2016-Dec,2016
794205286408003585,2016-11-03 15:51:10,Twitter for iPhone,This is Laika. She was a space pupper. The first space pupper actually. Orbited earth like a h*ckin boss. 14/10 hero af https://t.co/trSjgY3h4g,14,Laika,10,pupper,pupper,2016-Nov,2016
789903600034189313,2016-10-22 18:57:48,Vine - Make a Scene,This is Ralphy. His dreams were just shattered. Poor pupper. 13/10 it'll be ok Ralphy https://t.co/P0kSN6rT6H,13,Ralphy,10,pupper,pupper,2016-Oct,2016
778027034220126208,2016-09-20 00:24:34,Twitter for iPhone,This is Sophie. She's a Jubilant Bush Pupper. Super h*ckin rare. Appears at random just to smile at the locals. 11.27/10 would smile back https://t.co/QFaUiIHxHq,27,Sophie,10,pupper,pupper,2016-Sep,2016
776477788987613185,2016-09-15 17:48:25,Twitter for iPhone,This is Huck. He's addicted to caffeine. Hope it's not too latte to seek help. 11/10 stay strong pupper https://t.co/iJE3F0VozW,11,Huck,10,pupper,pupper,2016-Sep,2016
776113305656188928,2016-09-14 17:40:06,Twitter for iPhone,This is Sampson. He's about to get hit with a vicious draw 2. Has no idea. 11/10 poor pupper https://t.co/FYT9QBEnKG,11,Sampson,10,pupper,pupper,2016-Sep,2016
773985732834758656,2016-09-08 20:45:53,Twitter for iPhone,Meet Winnie. She just made awkward eye contact with the driver beside her. Poor pupper panicked. 11/10 would comfort https://t.co/RFWtDqTnAz,11,Winnie,10,pupper,pupper,2016-Sep,2016
773547596996571136,2016-09-07 15:44:53,Twitter for iPhone,This is Chelsea. She forgot how to dog. 11/10 get it together pupper https://t.co/nBJ5RE4yHb,11,Chelsea,10,pupper,pupper,2016-Sep,2016
772193107915964416,2016-09-03 22:02:38,Twitter for iPhone,This is Willem. He's a Penn State pupper. Thinks the hood makes him more intimidating. It doesn't. 12/10 https://t.co/Dp0s7MRIHK,12,Willem,10,pupper,pupper,2016-Sep,2016
765371061932261376,2016-08-16 02:14:15,Twitter for iPhone,This is Louie. He's had a long day. Did a lot of pupper things. Also appears to be rather heckin pettable. 11/10 https://t.co/w2qDmoTIZ5,11,Louie,10,pupper,pupper,2016-Aug,2016
756939218950160384,2016-07-23 19:49:07,Twitter for iPhone,This is Jax. He is a majestic mountain pupper. Thinks flat ground is for the weak. 12/10 would totally hike with https://t.co/KGdeHuFJnH,12,Jax,10,pupper,pupper,2016-Jul,2016
751950017322246144,2016-07-10 01:23:49,Vine - Make a Scene,This is Lola. She's a surfing pupper. 13/10 magical af https://t.co/BlGQkhM5EV,13,Lola,10,pupper,pupper,2016-Jul,2016
750868782890057730,2016-07-07 01:47:22,Twitter for iPhone,Meet Milo. He hauled ass until he ran out of treadmill and then passed out from exhaustion. 11/10 sleep tight pupper https://t.co/xe1aGZNkcC,11,Milo,10,pupper,pupper,2016-Jul,2016
750506206503038976,2016-07-06 01:46:38,Twitter for iPhone,This is Malcolm. He's absolutely terrified of heights. 8/10 hang in there pupper https://t.co/SVU00Sc9U2,8,Malcolm,10,pupper,pupper,2016-Jul,2016
750383411068534784,2016-07-05 17:38:41,Twitter for iPhone,This is Zoe. She was trying to stealthily take a picture of you but you just noticed. 9/10 not so sneaky pupper https://t.co/FfH3o88Vta,9,Zoe,10,pupper,pupper,2016-Jul,2016
749417653287129088,2016-07-03 01:41:06,Twitter for iPhone,This is Finn. He's the most unphotogenic pupper of all time. 11/10 https://t.co/qvA2rCUl6v,11,Finn,10,pupper,pupper,2016-Jul,2016
744223424764059648,2016-06-18 17:41:06,Twitter for iPhone,"This is actually a pupper and I'd pet it so well. 12/10
https://t.co/RNqS7C4Y4N",12,actually,10,pupper,pupper,2016-Jun,2016
743222593470234624,2016-06-15 23:24:09,Twitter for iPhone,This is a very rare Great Alaskan Bush Pupper. Hard to stumble upon without spooking. 12/10 would pet passionately https://t.co/xOBKCdpzaa,12,a,10,pupper,pupper,2016-Jun,2016
742150209887731712,2016-06-13 00:22:53,Twitter for iPhone,This is Edmund. He sends stellar selfies. Cute af. 8/10 would totally snapchat with this pupper https://t.co/PprXoqZuKY,8,Edmund,10,pupper,pupper,2016-Jun,2016
741743634094141440,2016-06-11 21:27:17,Twitter for iPhone,Meet Aqua. She's a sandy pupper. Not sure how she feels about being so sandy. Radical tongue slip. 11/10 petable af https://t.co/rYxJ0UQtbE,11,Aqua,10,pupper,pupper,2016-Jun,2016
740676976021798912,2016-06-08 22:48:46,Twitter for iPhone,"Meet Baloo. He's expecting a fast ground ball, hence the wide stance. Prepared af. 11/10 nothing runs like a pupper https://t.co/sMbMw5Z2XC",11,Baloo,10,pupper,pupper,2016-Jun,2016
739606147276148736,2016-06-05 23:53:41,Twitter for iPhone,Meet Benji. He just turned 1. Has already given up on a traditional pupper physique. Just inhaled that thing. 9/10 https://t.co/sLUC4th3Zj,9,Benji,10,pupper,pupper,2016-Jun,2016
736392552031657984,2016-05-28 03:04:00,Vine - Make a Scene,Say hello to mad pupper. You know what you did. 13/10 would pet until no longer furustrated https://t.co/u1ulQ5heLX,13,mad,10,pupper,pupper,2016-May,2016
736365877722001409,2016-05-28 01:18:00,Twitter for iPhone,This is Rory. He's extremely impatient. 11/10 settle down pupper https://t.co/e3tfXJLi40,11,Rory,10,pupper,pupper,2016-May,2016
735137028879360001,2016-05-24 15:55:00,Twitter for iPhone,Meet Buckley. His family &amp; some neighbors came over to watch him perform but he's nervous af. 9/10 u got this pupper https://t.co/5bdCpPlno9,9,Buckley,10,pupper,pupper,2016-May,2016
730573383004487680,2016-05-12 01:40:42,Twitter for iPhone,This is Rooney. He can't comprehend glass. 10/10 it'll be ok pupper https://t.co/CnUl2uDBBV,10,Rooney,10,pupper,pupper,2016-May,2016
728035342121635841,2016-05-05 01:35:26,Twitter for iPhone,This is all I want in my life. 12/10 for super sleepy pupper https://t.co/4RlLA5ObMh,12,all,10,pupper,pupper,2016-May,2016
728015554473250816,2016-05-05 00:16:48,Twitter for iPhone,This is Rueben. He has reached ultimate pupper zen state. 11/10 tranquil af https://t.co/Z167HgtnBi,11,Rueben,10,pupper,pupper,2016-May,2016
725786712245440512,2016-04-28 20:40:11,Twitter for iPhone,Say hello to Lillie. She's a Rutabagan Floofem. Poor pupper ate and then passed out. 11/10 relatable af https://t.co/uIdGqug9rw,11,Lillie,10,pupper,pupper,2016-Apr,2016
724405726123311104,2016-04-25 01:12:38,Twitter for iPhone,This is Ashleigh. She's having Coachella withdrawals. Didn't even go tho. 10/10 stay strong pupper https://t.co/nRUaKWnJfH,10,Ashleigh,10,pupper,pupper,2016-Apr,2016
724004602748780546,2016-04-23 22:38:43,Twitter for iPhone,This is Luther. He saw a ghost. Spooked af. 11/10 hang in there pupper https://t.co/EdKG43VvEl,11,Luther,10,pupper,pupper,2016-Apr,2016
721001180231503872,2016-04-15 15:44:11,Twitter for iPhone,This is Oliver. Bath time is upon him. His fear of the wetness postpones his ultimate pupper destiny. 11/10 https://t.co/AFzzKqR4tT,11,Oliver,10,pupper,pupper,2016-Apr,2016
720340705894408192,2016-04-13 19:59:42,Twitter for iPhone,This is Derek. He just got balled on. Can't even get up. Poor thing. 10/10 hang in there pupper https://t.co/BIRRF3bcWH,10,Derek,10,pupper,pupper,2016-Apr,2016
719704490224398336,2016-04-12 01:51:36,Twitter for iPhone,This is Clyde. He's making sure you're having a good train ride. 12/10 great pupper https://t.co/y206kWHAj0,12,Clyde,10,pupper,pupper,2016-Apr,2016
717009362452090881,2016-04-04 15:22:08,Twitter for iPhone,This is Smokey. He's having some sort of existential crisis. 10/10 hang in there pupper https://t.co/JmgF4dMpw0,10,Smokey,10,pupper,pupper,2016-Apr,2016
716447146686459905,2016-04-03 02:08:05,Vine - Make a Scene,This is Ozzy. He's acrobatic af. Legendary pupper status achieved. 13/10 https://t.co/gHWsCTu90E,13,Ozzy,10,pupper,pupper,2016-Apr,2016
711968124745228288,2016-03-21 17:30:03,Twitter for iPhone,Meet Winston. He's trapped in a cup of coffee. Poor pupper. 10/10 someone free him https://t.co/2e6cUtKUuc,10,Winston,10,pupper,pupper,2016-Mar,2016
711008018775851008,2016-03-19 01:54:56,Twitter for iPhone,This is Chuckles. He had a balloon but he accidentally let go of it and it floated away. 11/10 hang in there pupper https://t.co/68iNM7B5gW,11,Chuckles,10,pupper,pupper,2016-Mar,2016
707315916783140866,2016-03-08 21:23:50,Twitter for iPhone,This is Finnegus. He's trapped in a snow globe. Poor pupper. 10/10 would make sure no one shook it https://t.co/BjpOa52jQ4,10,Finnegus,10,pupper,pupper,2016-Mar,2016
705975130514706432,2016-03-05 04:36:02,Twitter for iPhone,This is Adele. Her tongue flies out of her mouth at random. It's a debilitating illness. 10/10 stay strong pupper https://t.co/cfn81n3FLO,10,Adele,10,pupper,pupper,2016-Mar,2016
705428427625635840,2016-03-03 16:23:38,Twitter for iPhone,This is Ambrose. He's an Alfalfa Ballyhoo. Draws pistol fast af. Pretty much runs the frontier. 11/10 lethal pupper https://t.co/ih6epBOxIA,11,Ambrose,10,pupper,pupper,2016-Mar,2016
704859558691414016,2016-03-02 02:43:09,Twitter for iPhone,Here is a heartbreaking scene of an incredible pupper being laid to rest. 10/10 RIP pupper https://t.co/81mvJ0rGRu,10,a,10,pupper,pupper,2016-Mar,2016
704347321748819968,2016-02-29 16:47:42,Twitter for iPhone,This is Ralphson. He's very confused. Wondering why he's sitting on Santa's lap in February. 10/10 stay woke pupper https://t.co/INphk4ltkZ,10,Ralphson,10,pupper,pupper,2016-Feb,2016
703611486317502464,2016-02-27 16:03:45,Twitter for iPhone,Meet Scooter. He's experiencing the pupper equivalent of dropping ur phone in a toilet 10/10 put it in some rice pup https://t.co/JSmX1FIEaW,10,Scooter,10,pupper,pupper,2016-Feb,2016
702598099714314240,2016-02-24 20:56:55,Twitter for iPhone,"This is Sansa. She's gotten too big for her chair. Not so smol anymore. 11/10 once a pupper, always a pupper https://t.co/IpAoztle2s",11,Sansa,10,pupper,pupper,2016-Feb,2016
701545186879471618,2016-02-21 23:13:01,Twitter for iPhone,Meet Millie. She's practicing her dive form for Rio. It's nearly perfect. Dedicated af. 10/10 go for gold pupper https://t.co/SDVkc4m96M,10,Millie,10,pupper,pupper,2016-Feb,2016
